{
  "schema_version": 2,
  "course": "MCR3U",
  "module": "M1",
  "live_class": "C2",
  "items": [
    {
      "ref": "live-class/MCR3U/M1/C2/question/function-notation",
      "stage": "join",
      "page_number": 1,
      "order": 1,
      "default_status": "inactive",
      "publish_modes": [
        "individual"
      ],
      "response_mode": "individual"
    },
    {
      "ref": "live-class/MCR3U/M1/C2/question/evaluate-f2",
      "stage": "join",
      "page_number": 1,
      "order": 2,
      "default_status": "inactive",
      "publish_modes": [
        "individual"
      ],
      "response_mode": "individual"
    },
    {
      "ref": "universal/question/teams-spark",
      "stage": "teams",
      "page_number": 2,
      "order": 1,
      "default_status": "inactive",
      "publish_modes": [
        "individual",
        "group_consensus"
      ],
      "response_mode": "individual"
    },
    {
      "ref": "universal/question/meet-team",
      "stage": "meet",
      "page_number": 3,
      "order": 1,
      "default_status": "inactive",
      "publish_modes": [
        "individual"
      ],
      "response_mode": "individual"
    },
    {
      "ref": "live-class/MCR3U/M1/C2/question/not-in-domain-sqrt",
      "stage": "round",
      "page_number": 4,
      "order": 1,
      "default_status": "inactive",
      "publish_modes": [
        "individual"
      ],
      "response_mode": "individual"
    },
    {
      "ref": "live-class/MCR3U/M1/C2/question/not-in-domain-reciprocal",
      "stage": "round",
      "page_number": 4,
      "order": 2,
      "default_status": "inactive",
      "publish_modes": [
        "individual"
      ],
      "response_mode": "individual"
    },
    {
      "ref": "course/MCR3U/media/square-root-transformation",
      "stage": "play",
      "page_number": 5,
      "order": 1,
      "default_status": "inactive",
      "publish_modes": [
        "individual"
      ],
      "response_mode": "individual"
    },
    {
      "ref": "live-class/MCR3U/M1/C2/question/parent-range-quadratic",
      "stage": "round_3",
      "page_number": 6,
      "order": 1,
      "default_status": "inactive",
      "publish_modes": [
        "individual"
      ],
      "response_mode": "individual"
    },
    {
      "ref": "live-class/MCR3U/M1/C2/question/parent-domain-sqrt",
      "stage": "round_3",
      "page_number": 6,
      "order": 2,
      "default_status": "inactive",
      "publish_modes": [
        "individual"
      ],
      "response_mode": "individual"
    },
    {
      "ref": "live-class/MCR3U/M1/C2/question/parent-domain-reciprocal",
      "stage": "round_3",
      "page_number": 6,
      "order": 3,
      "default_status": "inactive",
      "publish_modes": [
        "individual"
      ],
      "response_mode": "individual"
    }
  ],
  "pages": [
    {
      "id": "join",
      "name": "Join",
      "stage": "join"
    },
    {
      "id": "welcome",
      "name": "Welcome",
      "stage": "teams"
    },
    {
      "id": "meet",
      "name": "Meet",
      "stage": "meet"
    },
    {
      "id": "round_1",
      "name": "Round 1",
      "stage": "round"
    },
    {
      "id": "round_2",
      "name": "Round 2",
      "stage": "play"
    },
    {
      "id": "round_3",
      "name": "Round 3",
      "stage": "round_3"
    },
    {
      "id": "summary",
      "name": "Summary",
      "stage": "summary"
    }
  ],
  "team_challenge": {
    "context": "A rule subtracts one square root from another: f(x) = √(x − 5) − √(24 − 3x). Each square root only makes sense for some inputs.",
    "question": "Which inputs are allowed? What outputs can you actually get?",
    "speaker_notes": "Curator nominee C assigned to MCR3U M1 C1. MathNet 03xe (China Mathematical Competition) is inspiration only — do not label Exact. Live ask is A1.3 domain then range by trying endpoints and a middle value. Contest closed interval is not the student badge. Inverse (A1.6) is a weak tag; do not treat this as an inverse lesson."
  }
}
