{
  "schema_version": 2,
  "course": "MCF3M",
  "module": "M1",
  "live_class": "C2",
  "items": [
    {
      "ref": "live-class/MCF3M/M1/C2/question/function-notation",
      "stage": "join",
      "page_number": 1,
      "order": 1,
      "default_status": "inactive",
      "publish_modes": [
        "individual"
      ],
      "response_mode": "individual"
    },
    {
      "ref": "live-class/MCF3M/M1/C2/question/evaluate-f2",
      "stage": "join",
      "page_number": 1,
      "order": 2,
      "default_status": "inactive",
      "publish_modes": [
        "individual"
      ],
      "response_mode": "individual"
    },
    {
      "ref": "universal/question/teams-spark",
      "stage": "teams",
      "page_number": 2,
      "order": 1,
      "default_status": "inactive",
      "publish_modes": [
        "individual",
        "group_consensus"
      ],
      "response_mode": "individual"
    },
    {
      "ref": "universal/question/meet-team",
      "stage": "meet",
      "page_number": 3,
      "order": 1,
      "default_status": "inactive",
      "publish_modes": [
        "individual"
      ],
      "response_mode": "individual"
    },
    {
      "ref": "live-class/MCF3M/M1/C2/question/parabola-a",
      "stage": "round",
      "page_number": 4,
      "order": 1,
      "default_status": "inactive",
      "publish_modes": [
        "individual"
      ],
      "response_mode": "individual"
    },
    {
      "ref": "live-class/MCF3M/M1/C2/question/parabola-c",
      "stage": "round",
      "page_number": 4,
      "order": 2,
      "default_status": "inactive",
      "publish_modes": [
        "individual"
      ],
      "response_mode": "individual"
    },
    {
      "ref": "live-class/MCF3M/M1/C2/media/parent-transformations",
      "stage": "play",
      "page_number": 5,
      "order": 1,
      "default_status": "inactive",
      "publish_modes": [
        "individual"
      ],
      "response_mode": "individual"
    },
    {
      "ref": "live-class/MCF3M/M1/C2/question/transform-a-effect",
      "stage": "play",
      "page_number": 5,
      "order": 2,
      "default_status": "inactive",
      "publish_modes": [
        "individual"
      ],
      "response_mode": "individual"
    },
    {
      "ref": "live-class/MCF3M/M1/C2/question/transform-h-effect",
      "stage": "play",
      "page_number": 5,
      "order": 3,
      "default_status": "inactive",
      "publish_modes": [
        "individual"
      ],
      "response_mode": "individual"
    },
    {
      "ref": "live-class/MCF3M/M1/C2/question/transform-k-effect",
      "stage": "play",
      "page_number": 5,
      "order": 4,
      "default_status": "inactive",
      "publish_modes": [
        "individual"
      ],
      "response_mode": "individual"
    },
    {
      "ref": "live-class/MCF3M/M1/C2/question/transform-x-minus-3",
      "stage": "round_3",
      "page_number": 6,
      "order": 1,
      "default_status": "inactive",
      "publish_modes": [
        "individual"
      ],
      "response_mode": "individual"
    },
    {
      "ref": "live-class/MCF3M/M1/C2/question/transform-stretch-translate",
      "stage": "round_3",
      "page_number": 6,
      "order": 2,
      "default_status": "inactive",
      "publish_modes": [
        "individual"
      ],
      "response_mode": "individual"
    }
  ],
  "pages": [
    {
      "id": "join",
      "name": "Join",
      "stage": "join"
    },
    {
      "id": "welcome",
      "name": "Welcome",
      "stage": "teams"
    },
    {
      "id": "meet",
      "name": "Meet",
      "stage": "meet"
    },
    {
      "id": "round_1",
      "name": "Round 1",
      "stage": "round"
    },
    {
      "id": "round_2",
      "name": "Round 2",
      "stage": "play"
    },
    {
      "id": "round_3",
      "name": "Round 3",
      "stage": "round_3"
    },
    {
      "id": "summary",
      "name": "Summary",
      "stage": "summary"
    }
  ]
}
